{
  "fixture_schema_version": 1,
  "fixture_id": "stream.interrupted",
  "provider_contract_version": "1",
  "provenance": { "type": "synthetic" },
  "redaction": { "contains_live_data": false, "status": "reviewed" },
  "operation": "stream",
  "capabilities": {
    "text_generation": "supported",
    "model_discovery": "unknown",
    "streaming": "supported",
    "structured_output": "unknown",
    "tool_calling": "unknown",
    "usage": "unknown"
  },
  "request_match": {
    "messages": [
      { "role": "user", "content": "Interrupt the synthetic stream." }
    ],
    "tools": []
  },
  "script": {
    "clock": "manual",
    "steps": [
      { "sequence": 0, "type": "emit_delta", "text": "Synthetic " },
      {
        "sequence": 1,
        "type": "raise_normalized_error",
        "error": {
          "code": "connection",
          "message": "Provider connection failed."
        }
      }
    ]
  },
  "expected": {
    "outcome": "error",
    "normalized_error": {
      "code": "connection",
      "message": "Provider connection failed."
    },
    "retry_allowed": true,
    "failover_allowed": true,
    "request_count": 1
  },
  "required_capabilities": ["text_generation", "streaming"]
}
