{
  "fixture_schema_version": 1,
  "fixture_id": "health.healthy",
  "provider_contract_version": "1",
  "provenance": { "type": "synthetic" },
  "redaction": { "contains_live_data": false, "status": "reviewed" },
  "operation": "check_health",
  "capabilities": {
    "text_generation": "unknown",
    "model_discovery": "unknown",
    "streaming": "unknown",
    "structured_output": "unknown",
    "tool_calling": "unknown",
    "usage": "unknown"
  },
  "request_match": { "messages": [], "tools": [] },
  "script": {
    "clock": "manual",
    "steps": [
      {
        "sequence": 0,
        "type": "return",
        "result": { "kind": "health", "state": "healthy" }
      }
    ]
  },
  "expected": {
    "outcome": "success",
    "normalized_result": { "kind": "health", "state": "healthy" },
    "retry_allowed": false,
    "failover_allowed": false,
    "request_count": 1
  },
  "required_capabilities": []
}
