{
  "fixture_schema_version": 1,
  "fixture_id": "models.discovery_success",
  "provider_contract_version": "1",
  "provenance": { "type": "synthetic" },
  "redaction": { "contains_live_data": false, "status": "reviewed" },
  "operation": "discover_models",
  "capabilities": {
    "text_generation": "unknown",
    "model_discovery": "supported",
    "streaming": "unknown",
    "structured_output": "unknown",
    "tool_calling": "unknown",
    "usage": "unknown"
  },
  "request_match": { "messages": [], "tools": [] },
  "script": {
    "clock": "manual",
    "steps": [
      {
        "sequence": 0,
        "type": "return",
        "result": {
          "kind": "model_catalog",
          "models": [
            { "id": "synthetic-chat", "display_name": "Synthetic Chat" },
            {
              "id": "synthetic-structured",
              "display_name": "Synthetic Structured"
            }
          ]
        }
      }
    ]
  },
  "expected": {
    "outcome": "success",
    "normalized_result": {
      "kind": "model_catalog",
      "models": [
        { "id": "synthetic-chat", "display_name": "Synthetic Chat" },
        {
          "id": "synthetic-structured",
          "display_name": "Synthetic Structured"
        }
      ]
    },
    "retry_allowed": false,
    "failover_allowed": false,
    "request_count": 1
  },
  "required_capabilities": ["model_discovery"]
}
